<?xml version="1.0"?>
<tematica xmlns:xs="http://www.w3.org/2001/XMLSchema-instance" xs:schemaLocation="../../../xml/schema/tematica.xsd">
  <descrizione>La connessione a banda larga alla rete Internet non e'
disponibile in tutto il territorio. Dov'e disponibile sarebbe meglio abbassare i costi di collegamento.
</descrizione>
<commento><username>admin</username><data>2009-03-15</data><voto>0</voto><nvoti>0</nvoti><testo>&amp;lt;zaa</testo></commento><commento><username>admin</username><data>2009-03-15</data><voto>0</voto><nvoti>0</nvoti><testo>fgkjzydf b</testo></commento><commento><username>admin</username><data>2009-03-15</data><voto>0</voto><nvoti>0</nvoti><testo>&amp;gt;&amp;gt;&amp;gt;&amp;gt;&amp;gt;&amp;gt;&amp;gt;&amp;gt;</testo></commento><commento><username>admin</username><data>2009-03-15</data><voto>0</voto><nvoti>0</nvoti><testo>&amp;lt;</testo></commento></tematica>
