<?xml version="1.0"?>
<tematica xmlns:xs="http://www.w3.org/2001/XMLSchema-instance" xs:schemaLocation="../../../xml/schema/tematica.xsd">
  <descrizione>I tralci potati dalle viti devono essere smaltiti</descrizione>
  <commento>
    <username>Tizio</username>
    <data>2009-01-27</data>
    <voto>2</voto>
	 <nvoti>10</nvoti>
    <testo>Ci sono aziende che si occupano proprio dello smaltimento delle biomasse e forse sarebbe meglio affidarsi a loro</testo>
  </commento>
  <commento>
    <username>Caio</username>
    <data>2009-02-08</data>
    <voto>3.6</voto>
	 <nvoti>6</nvoti>
    <testo>Mi auguro piu che altro che nessuno si dia al fai da te bruciando per conto suo i tralci</testo>
  </commento>
</tematica>
